{
  "schemaVersion": 1,
  "ruleset": "vanilla",
  "verification": "unverified",
  "counts": {
    "encounterFiles": 59,
    "bossResearchUnits": 59,
    "retainedEvidenceEncounters": 51,
    "sourceOnlyEncounters": 8,
    "providerMappedEncounters": 51,
    "providerUnresolvedEncounters": 8,
    "metadataOnlyMappings": 0
  },
  "entries": [
    {
      "unitId": "vanilla-aq20-ayamiss",
      "boss": "Ayamiss the Hunter",
      "raid": "Ruins of Ahn'Qiraj",
      "path": "vanilla/vanilla-aq20-ayamiss.json",
      "bossUnits": [
        "vanilla-aq20-ayamiss"
      ],
      "encounterId": null,
      "rawEncounterId": 722,
      "retainedCombatEventsAvailable": false,
      "mechanicCount": 7,
      "verification": "unverified",
      "providerMappingStatus": "unresolved"
    },
    {
      "unitId": "vanilla-aq20-buru",
      "boss": "Buru the Gorger",
      "raid": "Ruins of Ahn'Qiraj",
      "path": "vanilla/vanilla-aq20-buru.json",
      "bossUnits": [
        "vanilla-aq20-buru"
      ],
      "encounterId": null,
      "rawEncounterId": 721,
      "retainedCombatEventsAvailable": false,
      "mechanicCount": 6,
      "verification": "unverified",
      "providerMappingStatus": "unresolved"
    },
    {
      "unitId": "vanilla-aq20-kurinnaxx",
      "boss": "Kurinnaxx",
      "raid": "Ruins of Ahn'Qiraj",
      "path": "vanilla/vanilla-aq20-kurinnaxx.json",
      "bossUnits": [
        "vanilla-aq20-kurinnaxx"
      ],
      "encounterId": null,
      "rawEncounterId": 718,
      "retainedCombatEventsAvailable": false,
      "mechanicCount": 5,
      "verification": "unverified",
      "providerMappingStatus": "unresolved"
    },
    {
      "unitId": "vanilla-aq20-moam",
      "boss": "Moam",
      "raid": "Ruins of Ahn'Qiraj",
      "path": "vanilla/vanilla-aq20-moam.json",
      "bossUnits": [
        "vanilla-aq20-moam"
      ],
      "encounterId": null,
      "rawEncounterId": 720,
      "retainedCombatEventsAvailable": false,
      "mechanicCount": 5,
      "verification": "unverified",
      "providerMappingStatus": "unresolved"
    },
    {
      "unitId": "vanilla-aq20-ossirian",
      "boss": "Ossirian the Unscarred",
      "raid": "Ruins of Ahn'Qiraj",
      "path": "vanilla/vanilla-aq20-ossirian.json",
      "bossUnits": [
        "vanilla-aq20-ossirian"
      ],
      "encounterId": null,
      "rawEncounterId": 723,
      "retainedCombatEventsAvailable": false,
      "mechanicCount": 6,
      "verification": "unverified",
      "providerMappingStatus": "unresolved"
    },
    {
      "unitId": "vanilla-aq20-rajaxx",
      "boss": "General Rajaxx and wave commanders",
      "raid": "Ruins of Ahn'Qiraj",
      "path": "vanilla/vanilla-aq20-rajaxx.json",
      "bossUnits": [
        "vanilla-aq20-rajaxx"
      ],
      "encounterId": null,
      "rawEncounterId": 719,
      "retainedCombatEventsAvailable": false,
      "mechanicCount": 10,
      "verification": "unverified",
      "providerMappingStatus": "unresolved"
    },
    {
      "unitId": "vanilla-aq40-bug-trio",
      "boss": "Bug Trio",
      "raid": "Temple of Ahn'Qiraj",
      "path": "vanilla/vanilla-aq40-bug-trio.json",
      "bossUnits": [
        "vanilla-aq40-bug-trio"
      ],
      "encounterId": 50710,
      "rawEncounterId": 710,
      "retainedCombatEventsAvailable": true,
      "mechanicCount": 5,
      "verification": "unverified",
      "providerMappingStatus": "mapped-from-retained-report"
    },
    {
      "unitId": "vanilla-aq40-cthun",
      "boss": "C'Thun",
      "raid": "Temple of Ahn'Qiraj",
      "path": "vanilla/vanilla-aq40-cthun.json",
      "bossUnits": [
        "vanilla-aq40-cthun"
      ],
      "encounterId": 50717,
      "rawEncounterId": 717,
      "retainedCombatEventsAvailable": true,
      "mechanicCount": 6,
      "verification": "unverified",
      "providerMappingStatus": "mapped-from-retained-report"
    },
    {
      "unitId": "vanilla-aq40-fankriss",
      "boss": "Fankriss the Unyielding",
      "raid": "Temple of Ahn'Qiraj",
      "path": "vanilla/vanilla-aq40-fankriss.json",
      "bossUnits": [
        "vanilla-aq40-fankriss"
      ],
      "encounterId": 50712,
      "rawEncounterId": 712,
      "retainedCombatEventsAvailable": true,
      "mechanicCount": 4,
      "verification": "unverified",
      "providerMappingStatus": "mapped-from-retained-report"
    },
    {
      "unitId": "vanilla-aq40-huhuran",
      "boss": "Princess Huhuran",
      "raid": "Temple of Ahn'Qiraj",
      "path": "vanilla/vanilla-aq40-huhuran.json",
      "bossUnits": [
        "vanilla-aq40-huhuran"
      ],
      "encounterId": 50714,
      "rawEncounterId": 714,
      "retainedCombatEventsAvailable": true,
      "mechanicCount": 5,
      "verification": "unverified",
      "providerMappingStatus": "mapped-from-retained-report"
    },
    {
      "unitId": "vanilla-aq40-ouro",
      "boss": "Ouro",
      "raid": "Temple of Ahn'Qiraj",
      "path": "vanilla/vanilla-aq40-ouro.json",
      "bossUnits": [
        "vanilla-aq40-ouro"
      ],
      "encounterId": 50716,
      "rawEncounterId": 716,
      "retainedCombatEventsAvailable": true,
      "mechanicCount": 5,
      "verification": "unverified",
      "providerMappingStatus": "mapped-from-retained-report"
    },
    {
      "unitId": "vanilla-aq40-sartura",
      "boss": "Battleguard Sartura",
      "raid": "Temple of Ahn'Qiraj",
      "path": "vanilla/vanilla-aq40-sartura.json",
      "bossUnits": [
        "vanilla-aq40-sartura"
      ],
      "encounterId": 50711,
      "rawEncounterId": 711,
      "retainedCombatEventsAvailable": true,
      "mechanicCount": 4,
      "verification": "unverified",
      "providerMappingStatus": "mapped-from-retained-report"
    },
    {
      "unitId": "vanilla-aq40-skeram",
      "boss": "The Prophet Skeram",
      "raid": "Temple of Ahn'Qiraj",
      "path": "vanilla/vanilla-aq40-skeram.json",
      "bossUnits": [
        "vanilla-aq40-skeram"
      ],
      "encounterId": 50709,
      "rawEncounterId": 709,
      "retainedCombatEventsAvailable": true,
      "mechanicCount": 5,
      "verification": "unverified",
      "providerMappingStatus": "mapped-from-retained-report"
    },
    {
      "unitId": "vanilla-aq40-twin-emperors",
      "boss": "Twin Emperors",
      "raid": "Temple of Ahn'Qiraj",
      "path": "vanilla/vanilla-aq40-twin-emperors.json",
      "bossUnits": [
        "vanilla-aq40-twin-emperors"
      ],
      "encounterId": 50715,
      "rawEncounterId": 715,
      "retainedCombatEventsAvailable": true,
      "mechanicCount": 5,
      "verification": "unverified",
      "providerMappingStatus": "mapped-from-retained-report"
    },
    {
      "unitId": "vanilla-aq40-viscidus",
      "boss": "Viscidus",
      "raid": "Temple of Ahn'Qiraj",
      "path": "vanilla/vanilla-aq40-viscidus.json",
      "bossUnits": [
        "vanilla-aq40-viscidus"
      ],
      "encounterId": 50713,
      "rawEncounterId": 713,
      "retainedCombatEventsAvailable": true,
      "mechanicCount": 5,
      "verification": "unverified",
      "providerMappingStatus": "mapped-from-retained-report"
    },
    {
      "unitId": "vanilla-bwl-broodlord",
      "boss": "Broodlord Lashlayer",
      "raid": "Blackwing Lair",
      "path": "vanilla/vanilla-bwl-broodlord.json",
      "bossUnits": [
        "vanilla-bwl-broodlord"
      ],
      "encounterId": 50612,
      "rawEncounterId": 612,
      "retainedCombatEventsAvailable": true,
      "mechanicCount": 6,
      "verification": "unverified",
      "providerMappingStatus": "mapped-from-retained-report"
    },
    {
      "unitId": "vanilla-bwl-chromaggus",
      "boss": "Chromaggus",
      "raid": "Blackwing Lair",
      "path": "vanilla/vanilla-bwl-chromaggus.json",
      "bossUnits": [
        "vanilla-bwl-chromaggus"
      ],
      "encounterId": 50616,
      "rawEncounterId": 616,
      "retainedCombatEventsAvailable": true,
      "mechanicCount": 6,
      "verification": "unverified",
      "providerMappingStatus": "mapped-from-retained-report"
    },
    {
      "unitId": "vanilla-bwl-ebonroc",
      "boss": "Ebonroc",
      "raid": "Blackwing Lair",
      "path": "vanilla/vanilla-bwl-ebonroc.json",
      "bossUnits": [
        "vanilla-bwl-ebonroc"
      ],
      "encounterId": 50614,
      "rawEncounterId": 614,
      "retainedCombatEventsAvailable": true,
      "mechanicCount": 5,
      "verification": "unverified",
      "providerMappingStatus": "mapped-from-retained-report"
    },
    {
      "unitId": "vanilla-bwl-firemaw",
      "boss": "Firemaw",
      "raid": "Blackwing Lair",
      "path": "vanilla/vanilla-bwl-firemaw.json",
      "bossUnits": [
        "vanilla-bwl-firemaw"
      ],
      "encounterId": 50613,
      "rawEncounterId": 613,
      "retainedCombatEventsAvailable": true,
      "mechanicCount": 5,
      "verification": "unverified",
      "providerMappingStatus": "mapped-from-retained-report"
    },
    {
      "unitId": "vanilla-bwl-flamegor",
      "boss": "Flamegor",
      "raid": "Blackwing Lair",
      "path": "vanilla/vanilla-bwl-flamegor.json",
      "bossUnits": [
        "vanilla-bwl-flamegor"
      ],
      "encounterId": 50615,
      "rawEncounterId": 615,
      "retainedCombatEventsAvailable": true,
      "mechanicCount": 5,
      "verification": "unverified",
      "providerMappingStatus": "mapped-from-retained-report"
    },
    {
      "unitId": "vanilla-bwl-nefarian",
      "boss": "Nefarian",
      "raid": "Blackwing Lair",
      "path": "vanilla/vanilla-bwl-nefarian.json",
      "bossUnits": [
        "vanilla-bwl-nefarian"
      ],
      "encounterId": 50617,
      "rawEncounterId": 617,
      "retainedCombatEventsAvailable": true,
      "mechanicCount": 7,
      "verification": "unverified",
      "providerMappingStatus": "mapped-from-retained-report"
    },
    {
      "unitId": "vanilla-bwl-razorgore",
      "boss": "Razorgore the Untamed",
      "raid": "Blackwing Lair",
      "path": "vanilla/vanilla-bwl-razorgore.json",